Rank,Previous Rank,First Appearance,First Rank,Name,Computer,Site,Manufacturer,Country,Year,Segment,Total Cores,Accelerator/Co-Processor Cores,Rmax [TFlop/s],Rpeak [TFlop/s],Nmax,Nhalf,HPCG [TFlop/s],Power (kW),Power Source,Power Effeciency [GFlops/Watts],Architecture,Processor,Processor Technology,Processor Speed (MHz),Operating System,OS Family,Accelerator/Co-Processor,Cores per Socket,Processor Generation,System Model,System Family,Interconnect Family,Interconnect,Region,Continent,Site ID,System ID
436,315.0,45,87,Sekirei-ACC,"SGI ICE XA, Xeon E5-2680v3 12C 2.5GHz, Infiniband FDR, Nvidia K40",University of Tokyo/Institute for Solid State Physics,HPE,Japan,2015,Academic,15552,8640.0,777.4,1100.16,1935360.0,,,255.3,Submitted,3.045,Cluster,Xeon E5-2680v3 12C 2.5GHz,Intel Haswell,2500,SUSE Linux Enterprise Server 11,Linux,NVIDIA Tesla K40,12,Intel Xeon E5 (Haswell),SGI ICE XA,SGI ICE,Infiniband,Infiniband FDR,Eastern Asia,Asia,49208,178527
442,320.0,47,126,ForHLR II,"Lenovo NeXtScale nx360M5, Xeon E5-2660v3 10C 2.6GHz, Infiniband EDR/FDR",Karlsruher Institut für Technologie (KIT) ,Lenovo,Germany,2016,Academic,22960,,768.336,955.136,2865408.0,,,435.0,Submitted,1.766,Cluster,Xeon E5-2660v3 10C 2.6GHz,Intel Haswell,2600,Linux,Linux,None,10,Intel Xeon E5 (Haswell),Lenovo NeXtScale nx360 M5,Lenovo NeXtScale,Infiniband,Infiniband EDR/FDR,Western Europe,Europe,50444,178840
468,344.0,43,51,COMA (PACS-IX),"Cray CS300 1027GR, Intel Xeon E5-2670v2  10C 2.500GHz, Infiniband FDR, Intel Xeon Phi 7110P","Center for Computational Sciences, University of Tsukuba",Cray Inc.,Japan,2014,Academic,55664,47824.0,745.997,998.502,1638400.0,,,365.8,Submitted,2.039,Cluster,Intel Xeon E5-2670v2  10C 2.5GHz,Intel IvyBridge,2500,Linux,Linux,Intel Xeon Phi 7110P,10,Intel Xeon E5 (IvyBridge),Cray CS300 1027GR,Cray CS300,Infiniband,Infiniband FDR,Eastern Asia,Asia,47529,178326
477,351.0,46,114,HiperGator 2.0,"PowerEdge C6320, Xeon E5-2698v3 16C 2.3GHz, Infiniband",University of Florida,Dell EMC,United States,2015,Academic,29184,,738.065,1073.971,3500160.0,,,384.0,Submitted,1.922,Cluster,Xeon E5-2698v3 16C 2.3GHz,Intel Haswell,2300,Redhat Enterprise Linux 6.5,Linux,None,16,Intel Xeon E5 (Haswell),PowerEdge C6320,Dell PowerEdge Cluster,Infiniband,Infiniband,North America,Americas,49751,178663
478,352.0,45,94,Earth System Numerical Simulator,"Sugon Cluster TC4600E, Xeon E5-2680v3 12C 2.5GHz, Infiniband FDR","LASG/Institute of Atmospheric Physics, CAS",Sugon,China,2015,Academic,24912,,738.0,996.48,4223000.0,,6.27,540.0,Submitted,1.367,Cluster,Xeon E5-2680v3 12C 2.5GHz,Intel Haswell,2500,Linux,Linux,None,12,Intel Xeon E5 (Haswell),Sugon Cluster TC4600E,Sugon Cluster,Infiniband,Infiniband FDR,Eastern Asia,Asia,49542,178562
499,371.0,40,67,BGQ,"BlueGene/Q, Power BQC 16C 1.600GHz, Custom Interconnect",SOSCIP/LKSAVI/University of Toronto,IBM,Canada,2012,Academic,65536,,715.551,838.861,,,,328.75,Submitted,2.177,MPP,Power BQC 16C 1.6GHz,PowerPC,1600,Linux,Linux,None,16,Power BQC,BlueGene/Q,IBM BlueGene,Custom Interconnect,Custom Interconnect,North America,Americas,50424,177831
